{"arms":{"baseline":{"binarySha256":"3c26deea6e1a5fcedfc82b36e113bc3a8af388f415c75593ec66eabf83d366b7","byDelay":[{"convergenceCalls":{"histogram":{"4":1,"5":3},"max":5.0,"median":5.0,"min":4.0,"p95":5.0,"total":19},"delayMs":200,"durationMs":{"max":297.67875,"median":286.328521,"min":247.504792,"p95":297.67875},"sampleCount":4},{"convergenceCalls":{"histogram":{"9":4},"max":9.0,"median":9.0,"min":9.0,"p95":9.0,"total":36},"delayMs":500,"durationMs":{"max":590.658542,"median":587.926791,"min":572.834167,"p95":590.658542},"sampleCount":4},{"convergenceCalls":{"histogram":{"15":4},"max":15.0,"median":15.0,"min":15.0,"p95":15.0,"total":60},"delayMs":1000,"durationMs":{"max":1059.085708,"median":1047.538396,"min":1043.713,"p95":1059.085708},"sampleCount":4}],"completedCount":12,"convergenceCalls":{"histogram":{"15":4,"4":1,"5":3,"9":4},"max":15.0,"median":9.0,"min":4.0,"p95":15.0,"total":115},"convergenceFailureCount":0,"documentValid":true,"durationMs":{"max":1059.085708,"median":587.926791,"min":247.504792,"p95":1059.085708},"graphIntegrityPassed":true,"sampleCount":12,"sourcePreserved":true,"writerFailureCount":0},"candidate":{"binarySha256":"4ffa7d215b637f3b7f529e43d28dd1fdb75de9196feb413ed7c8940d545fad35","byDelay":[{"convergenceCalls":{"histogram":{"1":4},"max":1.0,"median":1.0,"min":1.0,"p95":1.0,"total":4},"delayMs":200,"durationMs":{"max":237.3275,"median":234.813958,"min":233.495167,"p95":237.3275},"sampleCount":4},{"convergenceCalls":{"histogram":{"1":4},"max":1.0,"median":1.0,"min":1.0,"p95":1.0,"total":4},"delayMs":500,"durationMs":{"max":539.230375,"median":537.233167,"min":534.21025,"p95":539.230375},"sampleCount":4},{"convergenceCalls":{"histogram":{"1":4},"max":1.0,"median":1.0,"min":1.0,"p95":1.0,"total":4},"delayMs":1000,"durationMs":{"max":1042.020375,"median":1037.785521,"min":1034.3085,"p95":1042.020375},"sampleCount":4}],"completedCount":12,"convergenceCalls":{"histogram":{"1":12},"max":1.0,"median":1.0,"min":1.0,"p95":1.0,"total":12},"convergenceFailureCount":0,"documentValid":true,"durationMs":{"max":1042.020375,"median":537.233167,"min":233.495167,"p95":1042.020375},"graphIntegrityPassed":true,"sampleCount":12,"sourcePreserved":true,"writerFailureCount":0}},"comparison":{"byDelay":[{"candidateMinusBaselineMedianCalls":-4.0,"candidateMinusBaselineMedianDurationMs":-51.514563,"delayMs":200},{"candidateMinusBaselineMedianCalls":-8.0,"candidateMinusBaselineMedianDurationMs":-50.693624,"delayMs":500},{"candidateMinusBaselineMedianCalls":-14.0,"candidateMinusBaselineMedianDurationMs":-9.752875,"delayMs":1000}],"candidateMinusBaselineConvergenceCalls":-103,"candidateToBaselineConvergenceCallRatio":0.104348},"fixture":{"caseSetSha256":"efc4fa5af6ee1ac120b20a1a09919c91eafc9e34f446e06d3faf3e155f0b86f4","firstRepetition":0,"sampleCountPerArm":12},"method":{"counterbalancedSubmissionOrder":true,"delaysMs":[200,500,1000],"knownSuggestionIDCount":2,"pairedConcurrentStart":true,"pollIntervalMs":50,"repetitionsPerDelay":4,"verificationCallsExcluded":true,"waitTimeoutSeconds":3},"paidModelsInvoked":false,"passed":true,"schema":"urn:marginbench:suggestion-convergence-probe:v1","version":1}
